{
  "schema_version": "2.3",
  "project_id": "efp_01J00000000000000000000001",
  "root_path": "/workspace/example",
  "created_at": "2026-07-15T12:00:00Z",
  "head_tree_revision_id": "eft_01J00000000000000000000005",
  "projection_root": ".expflow/projections",
  "managed_exclusions": [
    ".expflow/**",
    ".git/**"
  ],
  "policy_profile": "default",
  "hook_profile": "local-semantic",
  "authority_document_profile": "mixed",
  "current_manifest_heads": {
    "import_tree": "efm_01J00000000000000000000015",
    "workflow_time_import_export": "efm_01J00000000000000000000016"
  }
}
